{"type":"object","properties":{"status":{"enum":["beta","end_of_life","maintenance","preview","stable"],"type":"string"},"name":{"description":"The human readable name of the module.","type":"string"},"description":{"description":"A short description of the module.","type":"string"},"icon":{"description":"The [Font Awesome](https://fontawesome.com/icons) icon name of the module.","type":"string"},"tags":{"description":"The tags associated with this module.","type":"array","items":{"type":"string"}},"authors":{"description":"The GitHub handle of the authors of the module.","type":"array","items":{"type":"string"}},"scripts":{"type":"object","additionalProperties":{"$ref":"#/definitions/ScriptConfig"}},"errors":{"type":"object","additionalProperties":{"$ref":"#/definitions/ErrorConfig"}},"dependencies":{"type":"object","additionalProperties":{"$ref":"#/definitions/DependencyConfig"}}},"additionalProperties":false,"required":["errors","scripts"],"definitions":{"ScriptConfig":{"type":"object","properties":{"name":{"description":"The human readable name of the script.","type":"string"},"description":{"description":"A short description of the script.","type":"string"},"public":{"description":"If the script can be called from the public HTTP interface.\n\nIf enabled, ensure that authentication & rate limits are configured for\nthis endpoints. See the `user` and `rate_limit` modules.","default":false,"type":"boolean"}},"additionalProperties":false},"ErrorConfig":{"type":"object","properties":{"name":{"description":"The human readable name of the error.","type":"string"},"description":{"description":"A short description of the error.","type":"string"}},"additionalProperties":false},"DependencyConfig":{"type":"object","additionalProperties":false}},"$schema":"http://json-schema.org/draft-07/schema#"}